{
  "schemaVersion": 1,
  "datasetVersion": "1.0.0",
  "asOf": "2026-10-29",
  "claimType": "documented-framework-evolution",
  "scope": {
    "minMajor": 14,
    "maxMajor": 22,
    "coverage": "Major engineering milestones and selected breaking changes; not every patch or migration instruction."
  },
  "sources": [
    {
      "id": "compatibility",
      "url": "https://angular.dev/reference/versions",
      "kind": "official-documentation",
      "retrievedAt": "2026-10-29",
      "locator": "Angular/Node.js/TypeScript/RxJS compatibility table",
      "availability": "verified"
    },
    {
      "id": "support",
      "url": "https://angular.dev/reference/releases",
      "kind": "official-documentation",
      "retrievedAt": "2026-10-29",
      "locator": "Actively supported versions; release cadence; update paths",
      "availability": "verified"
    },
    {
      "id": "update",
      "url": "https://angular.dev/update-guide",
      "kind": "official-documentation",
      "retrievedAt": "2026-10-29",
      "locator": "Select source and destination versions; one major at a time",
      "availability": "verified"
    },
    {
      "id": "release-14",
      "url": "https://github.com/angular/angular/releases/tag/14.0.0",
      "kind": "github-release",
      "retrievedAt": "2026-10-29",
      "locator": "Release date, features, breaking changes and deprecations",
      "availability": "verified"
    },
    {
      "id": "release-15",
      "url": "https://github.com/angular/angular/releases/tag/15.0.0",
      "kind": "github-release",
      "retrievedAt": "2026-10-29",
      "locator": "Release date, features, breaking changes and deprecations",
      "availability": "verified"
    },
    {
      "id": "release-16",
      "url": "https://github.com/angular/angular/releases/tag/16.0.0",
      "kind": "github-release",
      "retrievedAt": "2026-10-29",
      "locator": "Release date, features, breaking changes and deprecations",
      "availability": "verified"
    },
    {
      "id": "release-17",
      "url": "https://github.com/angular/angular/releases/tag/17.0.0",
      "kind": "github-release",
      "retrievedAt": "2026-10-29",
      "locator": "Release date, features, breaking changes and deprecations",
      "availability": "verified"
    },
    {
      "id": "release-18",
      "url": "https://github.com/angular/angular/releases/tag/18.0.0",
      "kind": "github-release",
      "retrievedAt": "2026-10-29",
      "locator": "Release date, features, breaking changes and deprecations",
      "availability": "verified"
    },
    {
      "id": "release-19",
      "url": "https://github.com/angular/angular/releases/tag/19.0.0",
      "kind": "github-release",
      "retrievedAt": "2026-10-29",
      "locator": "Release date, features, breaking changes and deprecations",
      "availability": "verified"
    },
    {
      "id": "release-20",
      "url": "https://github.com/angular/angular/releases/tag/20.0.0",
      "kind": "github-release",
      "retrievedAt": "2026-10-29",
      "locator": "Release date, features, breaking changes and deprecations",
      "availability": "verified"
    },
    {
      "id": "release-21",
      "url": "https://github.com/angular/angular/releases/tag/21.0.0",
      "kind": "github-release",
      "retrievedAt": "2026-10-29",
      "locator": "Release date, features, breaking changes and deprecations",
      "availability": "verified"
    },
    {
      "id": "release-17.1.0",
      "url": "https://github.com/angular/angular/releases/tag/17.1.0",
      "kind": "github-release",
      "retrievedAt": "2026-10-29",
      "locator": "Named section matching the claim",
      "availability": "verified"
    },
    {
      "id": "release-17.2.0",
      "url": "https://github.com/angular/angular/releases/tag/17.2.0",
      "kind": "github-release",
      "retrievedAt": "2026-10-29",
      "locator": "Named section matching the claim",
      "availability": "verified"
    },
    {
      "id": "release-17.3.0",
      "url": "https://github.com/angular/angular/releases/tag/17.3.0",
      "kind": "github-release",
      "retrievedAt": "2026-10-29",
      "locator": "Named section matching the claim",
      "availability": "verified"
    },
    {
      "id": "release-20.2.0",
      "url": "https://github.com/angular/angular/releases/tag/20.2.0",
      "kind": "github-release",
      "retrievedAt": "2026-10-29",
      "locator": "Named section matching the claim",
      "availability": "verified"
    },
    {
      "id": "cli-14",
      "url": "https://github.com/angular/angular-cli/releases/tag/14.0.0",
      "kind": "github-release",
      "retrievedAt": "2026-10-29",
      "locator": "CLI builders, compiler integration and schematic changes",
      "availability": "verified"
    },
    {
      "id": "cli-15",
      "url": "https://github.com/angular/angular-cli/releases/tag/15.0.0",
      "kind": "github-release",
      "retrievedAt": "2026-10-29",
      "locator": "CLI builders, compiler integration and schematic changes",
      "availability": "verified"
    },
    {
      "id": "cli-16",
      "url": "https://github.com/angular/angular-cli/releases/tag/16.0.0",
      "kind": "github-release",
      "retrievedAt": "2026-10-29",
      "locator": "CLI builders, compiler integration and schematic changes",
      "availability": "verified"
    },
    {
      "id": "cli-17",
      "url": "https://github.com/angular/angular-cli/releases/tag/17.0.0",
      "kind": "github-release",
      "retrievedAt": "2026-10-29",
      "locator": "CLI builders, compiler integration and schematic changes",
      "availability": "verified"
    },
    {
      "id": "cli-18",
      "url": "https://github.com/angular/angular-cli/releases/tag/18.0.0",
      "kind": "github-release",
      "retrievedAt": "2026-10-29",
      "locator": "CLI builders, compiler integration and schematic changes",
      "availability": "verified"
    },
    {
      "id": "cli-19",
      "url": "https://github.com/angular/angular-cli/releases/tag/19.0.0",
      "kind": "github-release",
      "retrievedAt": "2026-10-29",
      "locator": "CLI builders, compiler integration and schematic changes",
      "availability": "verified"
    },
    {
      "id": "cli-20",
      "url": "https://github.com/angular/angular-cli/releases/tag/20.0.0",
      "kind": "github-release",
      "retrievedAt": "2026-10-29",
      "locator": "CLI builders, compiler integration and schematic changes",
      "availability": "verified"
    },
    {
      "id": "cli-21",
      "url": "https://github.com/angular/angular-cli/releases/tag/21.0.0",
      "kind": "github-release",
      "retrievedAt": "2026-10-29",
      "locator": "CLI builders, compiler integration and schematic changes",
      "availability": "verified"
    },
    {
      "id": "release-22-unavailable",
      "url": "https://github.com/angular/angular/releases/tag/22.0.0",
      "kind": "github-release",
      "retrievedAt": "2026-10-29",
      "locator": "API and webpage returned HTTP 404 during review",
      "availability": "unavailable"
    },
    {
      "id": "blog-15",
      "url": "https://blog.angular.dev/angular-v15-is-now-available-df7be7f2f4c8",
      "kind": "official-release-blog",
      "retrievedAt": "2026-10-29",
      "locator": "Release announcement feature/status sections",
      "availability": "verified"
    },
    {
      "id": "blog-16",
      "url": "https://blog.angular.dev/angular-v16-is-here-4d7a28ec680d",
      "kind": "official-release-blog",
      "retrievedAt": "2026-10-29",
      "locator": "Release announcement feature/status sections",
      "availability": "verified"
    },
    {
      "id": "blog-17",
      "url": "https://blog.angular.dev/introducing-angular-v17-4d7033312e4b",
      "kind": "official-release-blog",
      "retrievedAt": "2026-10-29",
      "locator": "Release announcement feature/status sections",
      "availability": "verified"
    },
    {
      "id": "blog-18",
      "url": "https://blog.angular.dev/angular-v18-is-now-available-e79d5ac0affe",
      "kind": "official-release-blog",
      "retrievedAt": "2026-10-29",
      "locator": "Release announcement feature/status sections",
      "availability": "verified"
    },
    {
      "id": "blog-19",
      "url": "https://blog.angular.dev/meet-angular-v19-7b29dfd05b84",
      "kind": "official-release-blog",
      "retrievedAt": "2026-10-29",
      "locator": "Release announcement feature/status sections",
      "availability": "verified"
    },
    {
      "id": "blog-20",
      "url": "https://blog.angular.dev/announcing-angular-v20-b5c9c06cf301",
      "kind": "official-release-blog",
      "retrievedAt": "2026-10-29",
      "locator": "Release announcement feature/status sections",
      "availability": "verified"
    },
    {
      "id": "blog-21",
      "url": "https://blog.angular.dev/announcing-angular-v21-57946c34f14b",
      "kind": "official-release-blog",
      "retrievedAt": "2026-10-29",
      "locator": "Release announcement feature/status sections",
      "availability": "verified"
    },
    {
      "id": "blog-22",
      "url": "https://blog.angular.dev/announcing-angular-v22-c52bb83a4664",
      "kind": "official-release-blog",
      "retrievedAt": "2026-10-29",
      "locator": "Release announcement feature/status sections",
      "availability": "verified"
    },
    {
      "id": "standalone-migration",
      "url": "https://angular.dev/reference/migrations/standalone",
      "kind": "official-documentation",
      "retrievedAt": "2026-10-29",
      "locator": "Named section matching the claim",
      "availability": "verified"
    },
    {
      "id": "control-migration",
      "url": "https://angular.dev/reference/migrations/control-flow",
      "kind": "official-documentation",
      "retrievedAt": "2026-10-29",
      "locator": "Named section matching the claim",
      "availability": "verified"
    },
    {
      "id": "typed-forms",